{
  "$schema": "http://json-schema.org/draft-06/schema",
  "type": "object",
  "properties": {
    "version": {
      "type": "number"
    },
    "success": {
      "type": "boolean"
    },
    "reason": {},
    "content": {
      "type": "object",
      "properties": {
        "href": {
          "type": "string"
        },
        "name": {
          "type": "string"
        },
        "created_at": {
          "type": "string"
        },
        "updated_at": {
          "type": "string"
        },
        "update_type": {
          "type": "string"
        },
        "created_by": {
          "type": "object",
          "properties": {
            "href": {
              "type": "string"
            }
          }
        },
        "updated_by": {
          "type": "object",
          "properties": {
            "href": {
              "type": "string"
            }
          }
        },
        "caps": {
          "type": "array",
          "items": {
            "type": "string"
          }
        },
        "apply_to": {
          "type": "string"
        },
        "service_ports": {
          "type": "array",
          "items": {
            "type": "object",
            "properties": {
              "port": {
                "type": "integer"
              },
              "proto": {
                "type": "integer"
              }
            }
          }
        },
        "ip_overrides": {
          "type": "array"
        }
      }
    },
    "raw": {},
    "inputs": {
      "type": "object",
      "properties": {
        "illumio_protocol": {
          "type": "string"
        },
        "illumio_port": {
          "type": "integer"
        },
        "illumio_virtual_service_name": {
          "type": "string"
        }
      }
    },
    "metrics": {
      "type": "object",
      "properties": {
        "version": {
          "type": "string"
        },
        "package": {
          "type": "string"
        },
        "package_version": {
          "type": "string"
        },
        "host": {
          "type": "string"
        },
        "execution_time_ms": {
          "type": "integer"
        },
        "timestamp": {
          "type": "string"
        }
      }
    }
  }
}